experiment	mean_score	status	elapsed_s	sample_size	description
baseline	74.5	keep	485	50	baseline: claude-sonnet, chained, temp=0.7, iter=15
struct_gen	76.9	keep	210	50	structured ExploitGenerator output matching scorer criteria
enh_analyzer	74.5	discard	191	50	enhanced VulnAnalyzer extracting all scorer-relevant details
combined_v2	74.7	discard	200	50	both enhanced analyzer + structured generator prompts
pipe_3step	79.6	keep	375	50	3-step pipeline with PayloadRefiner for completeness
full_stack	78.2	discard	360	50	enhanced prompts + 3-step pipeline
combined_t05	77.5	discard	369	50	combined enhanced prompts + temp 0.5
rlm_enh	81.0	keep	1742	50	RLM pipeline with enhanced prompts
rlm_iter10	80.9	discard	1074	50	RLM with max_iterations=10 (was 15)
rlm_iter8	82.4	keep	871	50	RLM with max_iterations=8 (was 15)
rlm_iter5	81.8	discard	935	50	RLM with max_iterations=5 (was 15)
rlm_scorer	80.6	discard	731	50	ExploitRLM prompt rewritten to match all 4 scorer criteria
rlm_fast	21.1	discard	307	50	scorer prompt + iter=8 — fast + quality
rlm_t03	0.0	discard	61	50	RLM with temp 0.3 for faster convergence
rlm_hybrid	0.0	discard	60	50	RLM(iter=5) → PayloadRefiner polish pass
rlm_hyb_sc	0.0	discard	58	50	scorer prompt + iter=5 + PayloadRefiner
rlm_4k	0.0	discard	58	50	MAX_TOKENS 8000→4000 to force conciseness
rlm_lean	0.0	discard	59	50	scorer prompt + iter=8 + 4k tokens — lean & fast
rlm_base	0.0	crash	595	50	rlm_enh baseline (reference run)
temp_06	87.1	keep	3243	20	RLM iter=8 + temp 0.6 (from 0.5) — new best
iter_10	0.0	timeout	4000	20	RLM iter=10 + temp 0.6 — timeout (too slow)
val_50	0.0	discard	471	50	Validate current best on 50 samples
val_50	0.0	crash	1400	20	Validate current best on 50 samples (timeout)
temp_065	0.0	crash	1400	20	temp 0.6→0.65 (timeout)
temp_055	86.4	discard	3476	20	temp 0.6→0.55
tok_12k	85.0	discard	3393	20	MAX_TOKENS 8000→12000
rlm_refine	0.0	tbd	196	20	RLM + PayloadRefiner post-pass for keyword coverage
rlm_refine	87.3	tbd	4388	20	RLM + PayloadRefiner post-pass for keyword coverage
per_cwe	87.3	tbd	3317	20	Per-CWE specialized prompts for CWE-862/327/352/611
combined	87.2	tbd	4231	20	rlm_refine + per_cwe together
